{
  "schema": "uads.execution-packet",
  "schemaVersion": "0.3.0",
  "executionRunId": "er_8ce6f0a2afdfc930",
  "workOrderId": "wo_9bfd07a91b9b364f",
  "objective": "Fix a typo in the README.",
  "includedScope": [
    "Fix a typo in the README."
  ],
  "outOfScope": [
    "unrelated architecture refactors",
    "unrelated Web3/tokenomics work",
    "unrelated marketplace or dashboard features"
  ],
  "riskLevel": "LOW",
  "domains": [
    "documentation"
  ],
  "contextRadius": "C1",
  "contextCandidates": [
    "docs"
  ],
  "specialists": [
    "repo-inspector",
    "implementation-planner",
    "implementation-agent",
    "test-engineer",
    "checkpoint-manager",
    "documentation-dx-specialist"
  ],
  "assuranceReviewers": [
    "independent-reviewer"
  ],
  "specialistSelectionPlanId": "sp_a0aecaafc9b8ca9c",
  "specialistSelectionDigest": "84775798f3a91215c942e4abe6cbd89709a97ffa7a30c1f10b03b94da777ad4b",
  "specialistAssignments": [
    {
      "specialistId": "checkpoint-manager",
      "role": "Persist bounded resume and checkpoint state",
      "objective": "Fix a typo in the README.",
      "coveredDomains": [
        "general"
      ],
      "relevantAffectedAreas": [],
      "relevantFiles": [],
      "relevantGates": [
        "static"
      ],
      "evidenceObligations": [
        "atomic checkpoint"
      ],
      "riskLevel": "LOW",
      "forbiddenScope": [
        "Must persist only sanitized sidecar state outside the managed project.",
        "out-of-scope work",
        "unrelated architecture refactors",
        "unrelated marketplace or dashboard features",
        "unrelated Web3/tokenomics work"
      ],
      "dependencyGroup": 1,
      "parallelEligible": false
    },
    {
      "specialistId": "documentation-dx-specialist",
      "role": "Handle documentation and developer experience",
      "objective": "Fix a typo in the README.",
      "coveredDomains": [
        "documentation"
      ],
      "relevantAffectedAreas": [],
      "relevantFiles": [],
      "relevantGates": [
        "static"
      ],
      "evidenceObligations": [
        "documentation verification"
      ],
      "riskLevel": "LOW",
      "forbiddenScope": [
        "Must not spawn unrelated technical stacks for a documentation-only change.",
        "out-of-scope work",
        "unrelated architecture refactors",
        "unrelated marketplace or dashboard features",
        "unrelated Web3/tokenomics work"
      ],
      "dependencyGroup": 2,
      "parallelEligible": true
    },
    {
      "specialistId": "implementation-agent",
      "role": "Apply necessary in-scope product edits",
      "objective": "Fix a typo in the README.",
      "coveredDomains": [
        "general"
      ],
      "relevantAffectedAreas": [],
      "relevantFiles": [],
      "relevantGates": [
        "static"
      ],
      "evidenceObligations": [
        "in-scope change"
      ],
      "riskLevel": "LOW",
      "forbiddenScope": [
        "Must not perform approval-gated actions or serve as the sole final reviewer.",
        "out-of-scope work",
        "unrelated architecture refactors",
        "unrelated marketplace or dashboard features",
        "unrelated Web3/tokenomics work"
      ],
      "dependencyGroup": 4,
      "parallelEligible": false
    },
    {
      "specialistId": "implementation-planner",
      "role": "Produce a bounded executable Work Order plan",
      "objective": "Fix a typo in the README.",
      "coveredDomains": [
        "general"
      ],
      "relevantAffectedAreas": [],
      "relevantFiles": [],
      "relevantGates": [
        "static"
      ],
      "evidenceObligations": [
        "Work Order plan"
      ],
      "riskLevel": "LOW",
      "forbiddenScope": [
        "Must not dispatch work outside the selected scope.",
        "out-of-scope work",
        "unrelated architecture refactors",
        "unrelated marketplace or dashboard features",
        "unrelated Web3/tokenomics work"
      ],
      "dependencyGroup": 2,
      "parallelEligible": false
    },
    {
      "specialistId": "independent-reviewer",
      "role": "Independently review the implementation",
      "objective": "Fix a typo in the README.",
      "coveredDomains": [
        "quality"
      ],
      "relevantAffectedAreas": [],
      "relevantFiles": [],
      "relevantGates": [
        "static"
      ],
      "evidenceObligations": [
        "independent review"
      ],
      "riskLevel": "LOW",
      "forbiddenScope": [
        "approving without independent evidence",
        "implementing product changes",
        "Must use an independent session and must not implement the reviewed change.",
        "out-of-scope work",
        "unrelated architecture refactors",
        "unrelated marketplace or dashboard features",
        "unrelated Web3/tokenomics work"
      ],
      "dependencyGroup": 5,
      "parallelEligible": false
    },
    {
      "specialistId": "repo-inspector",
      "role": "Inspect repository metadata and project identity",
      "objective": "Fix a typo in the README.",
      "coveredDomains": [
        "general"
      ],
      "relevantAffectedAreas": [],
      "relevantFiles": [],
      "relevantGates": [
        "static"
      ],
      "evidenceObligations": [
        "repository map"
      ],
      "riskLevel": "LOW",
      "forbiddenScope": [
        "Must not edit product files or execute discovered project code.",
        "out-of-scope work",
        "unrelated architecture refactors",
        "unrelated marketplace or dashboard features",
        "unrelated Web3/tokenomics work"
      ],
      "dependencyGroup": 1,
      "parallelEligible": false
    },
    {
      "specialistId": "test-engineer",
      "role": "Design and run focused verification",
      "objective": "Fix a typo in the README.",
      "coveredDomains": [
        "quality"
      ],
      "relevantAffectedAreas": [],
      "relevantFiles": [],
      "relevantGates": [
        "static"
      ],
      "evidenceObligations": [
        "gate:static",
        "test evidence"
      ],
      "riskLevel": "LOW",
      "forbiddenScope": [
        "Must not self-approve implementation changes.",
        "out-of-scope work",
        "unrelated architecture refactors",
        "unrelated marketplace or dashboard features",
        "unrelated Web3/tokenomics work"
      ],
      "dependencyGroup": 3,
      "parallelEligible": false
    }
  ],
  "selectedGates": [
    "static"
  ],
  "acceptanceCriteria": [
    "Requested objective is met",
    "Selected gates have evidence",
    "Independent review completed if implementation occurred"
  ],
  "requiredEvidence": [
    "gate:static"
  ],
  "safeAutonomousActions": [
    "repository reads",
    "local code edits",
    "local tests",
    "lint/typecheck/build",
    "review-bundle generation",
    "non-destructive Git inspection",
    "normal commits/pushes in an authorized workflow"
  ],
  "approvalGatedActions": [
    "production deployment",
    "spending money",
    "rotating real credentials",
    "destructive Git history rewrite",
    "publishing packages/releases when not already authorized"
  ],
  "stopConditions": [
    "missing required evidence",
    "approval-gated action requested",
    "hard token budget exceeded",
    "Begin from Work Order, checkpoint, compact repository map, Context Pack, and context candidates before source files."
  ],
  "baselineGitHead": "312e32946798eb3abbb49a79af08e13efb7719dc",
  "nextAction": "Generate a review ZIP if required. Do not deploy or transfer funds.",
  "contextPackId": "cpk_e09006fa39341650",
  "impactReportId": "imp_82ddc2972d5f9027",
  "indexDigest": "72634fb077a6a3798883bad19077d58ce23583355db2a2409c44d1375bc2518e",
  "modelPlanId": "mrp_f5c393ad9bd35256",
  "selectedProfileId": null,
  "selectedProviderId": null,
  "selectedModelId": null,
  "selectionMode": "host-managed",
  "modelExecutionStrategy": {
    "parallel": false,
    "roleDispatch": "role-cycling",
    "usageTelemetryAvailable": null
  }
}
